{
  "annotation_version": "1",
  "cases": [
    {
      "annotation": {
        "actor": "contract-author",
        "evidence": "Рукотворный контроль арифметики и контрактов; не независимая языковая оценка.",
        "history": [
          {
            "actor": "contract-author",
            "decision": "synthetic fixture",
            "revision": "1"
          }
        ],
        "method": "synthetic_contract",
        "status": "independently_verified"
      },
      "applicable": true,
      "categories": [
        "spelling"
      ],
      "context": "comment",
      "document": "spelling",
      "exceptions": [],
      "exhaustive": true,
      "id": "spelling",
      "labels": [
        {
          "anchors": [
            {
              "end": {
                "byte_offset": 22,
                "column": 14,
                "line": 1,
                "utf16_column": 14
              },
              "start": {
                "byte_offset": 10,
                "column": 8,
                "line": 1,
                "utf16_column": 8
              }
            }
          ],
          "annotation": {
            "actor": "contract-author",
            "evidence": "Рукотворный контроль арифметики и контрактов; не независимая языковая оценка.",
            "history": [
              {
                "actor": "contract-author",
                "decision": "synthetic fixture",
                "revision": "1"
              }
            ],
            "method": "synthetic_contract",
            "status": "independently_verified"
          },
          "category": "spelling",
          "context": "Synthetic controlled diagnosis",
          "corrections": [
            {
              "range": {
                "end": {
                  "byte_offset": 22,
                  "column": 14,
                  "line": 1,
                  "utf16_column": 14
                },
                "start": {
                  "byte_offset": 10,
                  "column": 8,
                  "line": 1,
                  "utf16_column": 8
                }
              },
              "text": "ошибка"
            }
          ],
          "id": "gold-1"
        }
      ],
      "languages": [
        "ru"
      ],
      "profile": null,
      "protected_ranges": [],
      "range": {
        "end": {
          "byte_offset": 60,
          "column": 35,
          "line": 1,
          "utf16_column": 35
        },
        "start": {
          "byte_offset": 3,
          "column": 4,
          "line": 1,
          "utf16_column": 4
        }
      },
      "split": "dev",
      "terms": [
        "CLI"
      ],
      "verdict": "errors"
    },
    {
      "annotation": {
        "actor": "contract-author",
        "evidence": "Рукотворный контроль арифметики и контрактов; не независимая языковая оценка.",
        "history": [
          {
            "actor": "contract-author",
            "decision": "synthetic fixture",
            "revision": "1"
          }
        ],
        "method": "synthetic_contract",
        "status": "independently_verified"
      },
      "applicable": true,
      "categories": [
        "grammar"
      ],
      "context": "comment",
      "document": "agreement",
      "exceptions": [],
      "exhaustive": true,
      "id": "agreement",
      "labels": [
        {
          "anchors": [
            {
              "end": {
                "byte_offset": 40,
                "column": 31,
                "line": 1,
                "utf16_column": 31
              },
              "start": {
                "byte_offset": 19,
                "column": 20,
                "line": 1,
                "utf16_column": 20
              }
            }
          ],
          "annotation": {
            "actor": "contract-author",
            "evidence": "Рукотворный контроль арифметики и контрактов; не независимая языковая оценка.",
            "history": [
              {
                "actor": "contract-author",
                "decision": "synthetic fixture",
                "revision": "1"
              }
            ],
            "method": "synthetic_contract",
            "status": "independently_verified"
          },
          "category": "grammar",
          "context": "Synthetic controlled diagnosis",
          "corrections": [
            {
              "range": {
                "end": {
                  "byte_offset": 40,
                  "column": 31,
                  "line": 1,
                  "utf16_column": 31
                },
                "start": {
                  "byte_offset": 19,
                  "column": 20,
                  "line": 1,
                  "utf16_column": 20
                }
              },
              "text": "Важный файл"
            }
          ],
          "id": "gold-1"
        }
      ],
      "languages": [
        "ru"
      ],
      "profile": null,
      "protected_ranges": [],
      "range": {
        "end": {
          "byte_offset": 61,
          "column": 43,
          "line": 1,
          "utf16_column": 43
        },
        "start": {
          "byte_offset": 19,
          "column": 20,
          "line": 1,
          "utf16_column": 20
        }
      },
      "split": "dev",
      "terms": [
        "CLI"
      ],
      "verdict": "errors"
    },
    {
      "annotation": {
        "actor": "contract-author",
        "evidence": "Рукотворный контроль арифметики и контрактов; не независимая языковая оценка.",
        "history": [
          {
            "actor": "contract-author",
            "decision": "synthetic fixture",
            "revision": "1"
          }
        ],
        "method": "synthetic_contract",
        "status": "independently_verified"
      },
      "applicable": true,
      "categories": [
        "punctuation"
      ],
      "context": "comment",
      "document": "punctuation",
      "exceptions": [],
      "exhaustive": true,
      "id": "punctuation",
      "labels": [
        {
          "anchors": [
            {
              "end": {
                "byte_offset": 33,
                "column": 20,
                "line": 1,
                "utf16_column": 20
              },
              "start": {
                "byte_offset": 33,
                "column": 20,
                "line": 1,
                "utf16_column": 20
              }
            }
          ],
          "annotation": {
            "actor": "contract-author",
            "evidence": "Рукотворный контроль арифметики и контрактов; не независимая языковая оценка.",
            "history": [
              {
                "actor": "contract-author",
                "decision": "synthetic fixture",
                "revision": "1"
              }
            ],
            "method": "synthetic_contract",
            "status": "independently_verified"
          },
          "category": "punctuation",
          "context": "Synthetic controlled diagnosis",
          "corrections": [
            {
              "range": {
                "end": {
                  "byte_offset": 33,
                  "column": 20,
                  "line": 1,
                  "utf16_column": 20
                },
                "start": {
                  "byte_offset": 33,
                  "column": 20,
                  "line": 1,
                  "utf16_column": 20
                }
              },
              "text": ","
            }
          ],
          "id": "gold-1"
        }
      ],
      "languages": [
        "ru"
      ],
      "profile": null,
      "protected_ranges": [],
      "range": {
        "end": {
          "byte_offset": 60,
          "column": 35,
          "line": 1,
          "utf16_column": 35
        },
        "start": {
          "byte_offset": 3,
          "column": 4,
          "line": 1,
          "utf16_column": 4
        }
      },
      "split": "dev",
      "terms": [
        "CLI"
      ],
      "verdict": "errors"
    },
    {
      "annotation": {
        "actor": "contract-author",
        "evidence": "Рукотворный контроль арифметики и контрактов; не независимая языковая оценка.",
        "history": [
          {
            "actor": "contract-author",
            "decision": "synthetic fixture",
            "revision": "1"
          }
        ],
        "method": "synthetic_contract",
        "status": "independently_verified"
      },
      "applicable": true,
      "categories": [
        "grammar"
      ],
      "context": "comment",
      "document": "repetition",
      "exceptions": [],
      "exhaustive": true,
      "id": "repetition",
      "labels": [
        {
          "anchors": [
            {
              "end": {
                "byte_offset": 19,
                "column": 12,
                "line": 1,
                "utf16_column": 12
              },
              "start": {
                "byte_offset": 2,
                "column": 3,
                "line": 1,
                "utf16_column": 3
              }
            }
          ],
          "annotation": {
            "actor": "contract-author",
            "evidence": "Рукотворный контроль арифметики и контрактов; не независимая языковая оценка.",
            "history": [
              {
                "actor": "contract-author",
                "decision": "synthetic fixture",
                "revision": "1"
              }
            ],
            "method": "synthetic_contract",
            "status": "independently_verified"
          },
          "category": "grammar",
          "context": "Synthetic controlled diagnosis",
          "corrections": [
            {
              "range": {
                "end": {
                  "byte_offset": 19,
                  "column": 12,
                  "line": 1,
                  "utf16_column": 12
                },
                "start": {
                  "byte_offset": 2,
                  "column": 3,
                  "line": 1,